{
  "schemaVersion": "1.0.0",
  "artifactId": "art_02TREMORPB000000000000000001",
  "projectId": "proj_02TREMORPROJ0000000000000001",
  "artifactType": "project-brief",
  "artifactVersion": 1,
  "contentSchemaVersion": "1.0.0",
  "lifecycleStatus": "ready",
  "evidenceStatus": "unverified",
  "approvalStatus": "proposed",
  "createdBy": {
    "schemaVersion": "1.0.0",
    "actorId": "actor_02VERAACTOR0000000000000001",
    "actorType": "vera",
    "displayName": "Vera"
  },
  "createdAt": "2026-07-28T13:25:00Z",
  "updatedAt": "2026-07-28T13:25:00Z",
  "sourceTurnId": "turn_02USERMSG0000000000000001",
  "workflowRunId": "run_02TREMORRUN0000000000000001",
  "content": {
    "goal": "Enable a wrist-worn tremor monitoring device by capturing hand tremor motion data for later analysis while confirming required runtime, measurement bandwidth, sampling, and calibration/form-factor needs before component selection.",
    "problemStatement": "The initial wearable tremor monitor must start with a functional architecture, but key runtime, tremor frequency range, sampling rate, and wearable form-factor/calibration constraints are not yet confirmed. The prototype must not encode component-level choices prematurely.",
    "intendedContext": "An early-stage team will prototype the wearable device, run short user sessions, and review timestamped motion data exports to decide next embedded component steps.",
    "projectStage": "concept",
    "scope": [
      "Functional specification for motion sensing, timing, timestamped data storage, and analysis-ready export.",
      "Functional design for acknowledging wearable comfort constraints and privacy-sensitive handling considerations as non-medical information.",
      "Explicit identification of unknown measurement-bandwidth, sampling, and runtime requirements."
    ],
    "outOfScope": [
      "Component-part selection (specific sensor modules, MCUs, boards).",
      "Firmware libraries, PCB layout, schematic validation, and simulation execution.",
      "Medical-device approval, clinical claims, and regulatory certification.",
      "Manufacturing planning and production deployment."
    ],
    "successCriteria": [
      "All produced artifacts conform to the v1 contracts.",
      "Explicit and inferred requirements are distinguishable.",
      "Unsupported assumptions are not presented as facts.",
      "The Next Action is derived from concrete blockers and open questions about wearable motion measurement needs."
    ],
    "assumptions": [
      {
        "assumptionId": "A1",
        "statement": "A single short session with a wrist-worn device is sufficient to collect preliminary motion data while runtime and sampling unknowns are still open.",
        "sourceType": "user-implied",
        "confidence": "medium",
        "confirmationStatus": "proposed"
      },
      {
        "assumptionId": "A2",
        "statement": "The initial architecture can treat measurement bandwidth, sampling rate, and calibration approach as configurable placeholders until the user confirms targets.",
        "sourceType": "system-inferred",
        "confidence": "low",
        "confirmationStatus": "needs-confirmation"
      }
    ],
    "unknowns": [
      {
        "schemaVersion": "1.0.0",
        "questionId": "question_02RUNTIMEBUDGETTREMOR000000000000001",
        "displayId": "Q1"
      },
      {
        "schemaVersion": "1.0.0",
        "questionId": "question_02TREMORFREQRANGEUNKNOWN000000000000001",
        "displayId": "Q2"
      },
      {
        "schemaVersion": "1.0.0",
        "questionId": "question_02SAMPLINGRATEUNKNOWN000000000000001",
        "displayId": "Q3"
      },
      {
        "schemaVersion": "1.0.0",
        "questionId": "question_02CALIBRATIONFORMFACTORUNKNOWN0000000000001",
        "displayId": "Q4"
      }
    ]
  }
}

