{
  "schemaVersion": "1.0.0",
  "artifactId": "art_05ROBOTPB000000000000000001",
  "projectId": "proj_05ROBOTPROJ0000000000000001",
  "artifactType": "project-brief",
  "artifactVersion": 1,
  "contentSchemaVersion": "1.0.0",
  "lifecycleStatus": "ready",
  "evidenceStatus": "unverified",
  "approvalStatus": "proposed",
  "createdBy": {
    "schemaVersion": "1.0.0",
    "actorId": "actor_05VERAACTOR0000000000000001",
    "actorType": "vera",
    "displayName": "Vera"
  },
  "createdAt": "2026-07-28T13:25:00Z",
  "updatedAt": "2026-07-28T13:25:00Z",
  "sourceTurnId": "turn_05USERMSG0000000000000001",
  "workflowRunId": "run_05ROBOTRUN0000000000000001",
  "content": {
    "goal": "Enable an obstacle-detection module for a small indoor robot that detects objects in front of it and issues timely reactions before collisions, while confirming detection range, reaction latency, robot-controller interface behavior, and indoor safety assumptions before component selection.",
    "problemStatement": "The initial obstacle-detection module requires a functional architecture, but key constraints for detection range/field of view, maximum reaction latency, robot-controller interface semantics, and indoor fail-safe safety assumptions are not yet confirmed. The prototype must remain non-component-specific until these unknowns are resolved.",
    "intendedContext": "An early-stage team will prototype the module, test obstacle detection and reaction timing in indoor scenarios, and review analysis-ready outputs to decide next embedded constraints.",
    "projectStage": "concept",
    "scope": [
      "Functional specification for obstacle sensing, obstacle interpretation, and reaction decision behavior.",
      "Functional design for timestamped obstacle evidence logging and safety-focused control behavior.",
      "Explicit identification of unknown obstacle range, reaction latency, interface behavior, and indoor safety constraints."
    ],
    "outOfScope": [
      "Component-part selection (specific sensor models, MCUs, cameras, lidars, or control algorithms).",
      "Firmware libraries, PCB layout, schematic validation, and simulation execution.",
      "Production manufacturing planning and deployment infrastructure."
    ],
    "successCriteria": [
      "All produced artifacts conform to the v1 contracts.",
      "Explicit and inferred requirements are distinguishable.",
      "Unsupported assumptions are not presented as facts.",
      "The Next Action is derived from concrete blockers and open questions about obstacle-detection needs."
    ],
    "assumptions": [
      {
        "assumptionId": "A1",
        "statement": "Indoor obstacle-avoidance behavior can be evaluated using functional architecture outputs without assuming specific component technologies in this phase.",
        "sourceType": "system-inferred",
        "confidence": "medium",
        "confirmationStatus": "proposed"
      }
    ],
    "unknowns": [
      {
        "schemaVersion": "1.0.0",
        "questionId": "question_05DETECTIONRANGEFOVUNKNOWN000000000000001",
        "displayId": "Q1"
      },
      {
        "schemaVersion": "1.0.0",
        "questionId": "question_05REACTIONLATENCYUNKNOWN000000000000001",
        "displayId": "Q2"
      },
      {
        "schemaVersion": "1.0.0",
        "questionId": "question_05ROBOTCONTROLLERINTERFACEUNKNOWN0000000000001",
        "displayId": "Q3"
      },
      {
        "schemaVersion": "1.0.0",
        "questionId": "question_05ENVIRONMENTSAFETYUNKNOWN000000000000001",
        "displayId": "Q4"
      }
    ]
  }
}

