{
  "schemaVersion": "1.0.0",
  "artifactId": "art_04VIBRATIONNXT000000000000000001",
  "projectId": "proj_04VIBRATIONPROJ0000000000000001",
  "artifactType": "next-action",
  "artifactVersion": 1,
  "contentSchemaVersion": "1.0.0",
  "lifecycleStatus": "ready",
  "evidenceStatus": "unverified",
  "approvalStatus": "proposed",
  "createdBy": {
    "schemaVersion": "1.0.0",
    "actorId": "actor_04VERAACTOR0000000000000001",
    "actorType": "vera",
    "displayName": "Vera"
  },
  "createdAt": "2026-07-28T13:25:00Z",
  "updatedAt": "2026-07-28T13:25:00Z",
  "sourceTurnId": "turn_04USERMSG0000000000000001",
  "workflowRunId": "run_04VIBRATIONRUN0000000000000001",
  "content": {
    "actionId": "act_04NEXTACTION0000000000000001",
    "title": "Confirm vibration bandwidth, dynamic range, recording mode, and mounting constraints before component selection",
    "description": "Validate the required vibration frequency range, expected dynamic/acceleration range, intended recording mode, and mounting/baseline constraints so future embedded component selection remains grounded in confirmed needs.",
    "rationale": "The current functional architecture represents unknown vibration targets as open questions, but selecting concrete measurement and recording strategies requires confirmed bandwidth, dynamic range, and mounting/baseline constraints.",
    "owner": "vera",
    "priority": "high",
    "prerequisites": [
      {
        "schemaVersion": "1.0.0",
        "questionId": "question_04VIBRATIONFREQUENCYBANDWIDTHUNKNOWN000000000000001",
        "displayId": "Q1"
      },
      {
        "schemaVersion": "1.0.0",
        "questionId": "question_04SAMPLERATERECORDINGMODEUNKNOWN00000000000001",
        "displayId": "Q2"
      },
      {
        "schemaVersion": "1.0.0",
        "questionId": "question_04DYNAMICRANGEACCELUNKNOWN000000000000001",
        "displayId": "Q3"
      },
      {
        "schemaVersion": "1.0.0",
        "questionId": "question_04MOUNTINGBASELINECALIBRATIONUNKNOWN000000000001",
        "displayId": "Q4"
      }
    ],
    "blocks": [
      {
        "issueId": "issue_04BLOCKVIBRATIONRANGERECORDINGMOUNTUNKNOWN000000000000001"
      }
    ],
    "completionCondition": {
      "conditionType": "unknowns-resolved",
      "completionCriteria": "Confirm (1) vibration frequency range/bandwidth, (2) dynamic/acceleration range, (3) recording mode (continuous vs triggered) and sampling rate needs, and (4) mounting constraints and baseline/calibration approach; then mark Q1-Q4 as answered/resolved and proceed to component selection in the next workflow."
    },
    "sourceIssueIds": [
      "issue_04BLOCKVIBRATIONRANGERECORDINGMOUNTUNKNOWN000000000000001",
      "issue_04WARNBASELINECALIBRATIONMETHODOLOGYUNCLEAR000000000000001"
    ],
    "sourceQuestionIds": [
      "question_04VIBRATIONFREQUENCYBANDWIDTHUNKNOWN000000000000001",
      "question_04SAMPLERATERECORDINGMODEUNKNOWN00000000000001",
      "question_04DYNAMICRANGEACCELUNKNOWN000000000000001",
      "question_04MOUNTINGBASELINECALIBRATIONUNKNOWN000000000001"
    ]
  }
}

